{
  "$schema": "https://json-schema.org/draft/2020-12/schema",
  "$id": "https://schemas.synaptixplay.com/music/project/v1.json",
  "title": "Synaptix Music Project",
  "type": "object",
  "additionalProperties": false,
  "required": ["schemaVersion", "projectId", "revisionId", "parentRevisionId", "metadata", "transport", "tempoMap", "timeSignatureMap", "tracks", "assets", "markers"],
  "properties": {
    "schemaVersion": { "const": 1 },
    "projectId": { "$ref": "#/$defs/id" },
    "revisionId": { "$ref": "#/$defs/id" },
    "parentRevisionId": { "oneOf": [{ "$ref": "#/$defs/id" }, { "type": "null" }] },
    "metadata": {
      "type": "object",
      "additionalProperties": false,
      "required": ["name", "createdAt", "updatedAt"],
      "properties": {
        "name": { "type": "string", "minLength": 1 },
        "createdAt": { "type": "string", "format": "date-time" },
        "updatedAt": { "type": "string", "format": "date-time" }
      }
    },
    "transport": {
      "type": "object",
      "additionalProperties": false,
      "required": ["ticksPerQuarterNote", "loopEnabled", "loopRange"],
      "properties": {
        "ticksPerQuarterNote": { "type": "integer", "minimum": 1 },
        "loopEnabled": { "type": "boolean" },
        "loopRange": { "oneOf": [{ "$ref": "#/$defs/musicalRange" }, { "type": "null" }] }
      }
    },
    "tempoMap": { "type": "array", "minItems": 1, "items": { "$ref": "#/$defs/tempoEvent" } },
    "timeSignatureMap": { "type": "array", "minItems": 1, "items": { "$ref": "#/$defs/timeSignatureEvent" } },
    "tracks": { "type": "array", "items": { "$ref": "#/$defs/track" } },
    "assets": { "type": "array", "items": { "$ref": "#/$defs/asset" } },
    "markers": { "type": "array", "items": { "$ref": "#/$defs/marker" } },
    "mixer": { "$ref": "#/$defs/mixer" },
    "key": { "$ref": "#/$defs/musicalKey" },
    "notebook": { "type": "array", "minItems": 1, "items": { "$ref": "#/$defs/notebookPage" } },
    "stickyNotes": { "type": "array", "minItems": 1, "items": { "$ref": "#/$defs/stickyNote" } },
    "generationMetadata": { "$ref": "#/$defs/generationMetadata" }
  },
  "$defs": {
    "id": { "type": "string", "minLength": 1 },
    "generationProvenance": {
      "type": "object",
      "additionalProperties": false,
      "required": ["licence", "commercialUse"],
      "properties": {
        "model": { "type": "string", "minLength": 1 },
        "licence": { "type": "string", "minLength": 1 },
        "commercialUse": { "enum": ["allowed", "not-allowed", "conditional"] },
        "planSha256": { "type": "string", "pattern": "^[0-9a-f]{64}$" },
        "credits": { "type": "array", "items": { "type": "string", "minLength": 1 } }
      }
    },
    "musicalKey": {
      "type": "object",
      "additionalProperties": false,
      "required": ["tonic", "mode"],
      "properties": {
        "tonic": { "type": "integer", "minimum": 0, "maximum": 11 },
        "mode": { "enum": ["major", "minor", "dorian", "phrygian", "lydian", "mixolydian", "harmonic minor"] }
      }
    },
    "stickyNote": {
      "type": "object",
      "additionalProperties": false,
      "required": ["id", "text"],
      "properties": {
        "id": { "$ref": "#/$defs/id" },
        "text": { "type": "string", "minLength": 1, "maxLength": 500 }
      }
    },
    "notebookPage": {
      "type": "object",
      "additionalProperties": false,
      "required": ["id", "title", "body"],
      "properties": {
        "id": { "$ref": "#/$defs/id" },
        "title": { "type": "string", "minLength": 1, "maxLength": 80 },
        "body": { "type": "string", "maxLength": 20000 }
      }
    },
    "position": {
      "type": "object",
      "additionalProperties": false,
      "required": ["bar", "beat", "tick"],
      "properties": {
        "bar": { "type": "integer", "minimum": 0 },
        "beat": { "type": "integer", "minimum": 0 },
        "tick": { "type": "integer", "minimum": 0 }
      }
    },
    "musicalRange": {
      "type": "object",
      "additionalProperties": false,
      "required": ["start", "durationTicks"],
      "properties": {
        "start": { "$ref": "#/$defs/position" },
        "durationTicks": { "type": "integer", "minimum": 1 }
      }
    },
    "tempoEvent": {
      "type": "object",
      "additionalProperties": false,
      "required": ["id", "position", "bpm"],
      "properties": {
        "id": { "$ref": "#/$defs/id" },
        "position": { "$ref": "#/$defs/position" },
        "bpm": { "type": "number", "minimum": 20, "maximum": 400 }
      }
    },
    "timeSignatureEvent": {
      "type": "object",
      "additionalProperties": false,
      "required": ["id", "position", "numerator", "denominator"],
      "properties": {
        "id": { "$ref": "#/$defs/id" },
        "position": { "$ref": "#/$defs/position" },
        "numerator": { "type": "integer", "minimum": 1, "maximum": 32 },
        "denominator": { "enum": [1, 2, 4, 8, 16, 32] }
      }
    },
    "midiNote": {
      "type": "object",
      "additionalProperties": false,
      "required": ["id", "pitch", "velocity", "startTick", "durationTicks"],
      "properties": {
        "id": { "$ref": "#/$defs/id" },
        "pitch": { "type": "integer", "minimum": 0, "maximum": 127 },
        "velocity": { "type": "integer", "minimum": 1, "maximum": 127 },
        "startTick": { "type": "integer", "minimum": 0 },
        "durationTicks": { "type": "integer", "minimum": 1 },
        "label": { "type": "string", "minLength": 1, "maxLength": 32 }
      }
    },
    "clip": {
      "oneOf": [
        {
          "type": "object",
          "additionalProperties": false,
          "required": ["id", "kind", "name", "range", "loop", "notes"],
          "properties": {
            "id": { "$ref": "#/$defs/id" },
            "kind": { "const": "midi" },
            "name": { "type": "string", "minLength": 1 },
            "range": { "$ref": "#/$defs/musicalRange" },
            "loop": { "type": "boolean" },
            "notes": { "type": "array", "items": { "$ref": "#/$defs/midiNote" } }
          }
        },
        {
          "type": "object",
          "additionalProperties": false,
          "required": ["id", "kind", "name", "range", "loop", "assetId", "sourceOffsetSeconds", "gainDb"],
          "properties": {
            "id": { "$ref": "#/$defs/id" },
            "kind": { "const": "audio" },
            "name": { "type": "string", "minLength": 1 },
            "range": { "$ref": "#/$defs/musicalRange" },
            "loop": { "type": "boolean" },
            "assetId": { "$ref": "#/$defs/id" },
            "sourceOffsetSeconds": { "type": "number", "minimum": 0 },
            "gainDb": { "type": "number", "minimum": -96, "maximum": 24 }
          }
        }
      ]
    },
    "device": {
      "type": "object",
      "additionalProperties": false,
      "required": ["id", "deviceType", "deviceVersion", "enabled", "parameters"],
      "properties": {
        "id": { "$ref": "#/$defs/id" },
        "deviceType": { "$ref": "#/$defs/id" },
        "deviceVersion": { "type": "string", "minLength": 1 },
        "enabled": { "type": "boolean" },
        "parameters": {
          "type": "array",
          "items": {
            "type": "object",
            "additionalProperties": false,
            "required": ["id", "value"],
            "properties": { "id": { "$ref": "#/$defs/id" }, "value": { "type": "number" } }
          }
        }
      }
    },
    "track": {
      "type": "object",
      "additionalProperties": false,
      "required": ["id", "name", "kind", "muted", "solo", "volumeDb", "pan", "devices", "clips"],
      "properties": {
        "id": { "$ref": "#/$defs/id" },
        "name": { "type": "string", "minLength": 1 },
        "kind": { "enum": ["instrument", "audio", "bus"] },
        "color": { "type": "string", "pattern": "^#[0-9a-fA-F]{6}$" },
        "muted": { "type": "boolean" },
        "solo": { "type": "boolean" },
        "volumeDb": { "type": "number", "minimum": -96, "maximum": 24 },
        "pan": { "type": "number", "minimum": -1, "maximum": 1 },
        "outputBusId": { "$ref": "#/$defs/id" },
        "reverbSend": { "type": "number", "minimum": 0, "maximum": 1 },
        "devices": { "type": "array", "items": { "$ref": "#/$defs/device" } },
        "clips": { "type": "array", "items": { "$ref": "#/$defs/clip" } },
        "stickyNotes": { "type": "array", "minItems": 1, "items": { "$ref": "#/$defs/stickyNote" } }
      }
    },
    "asset": {
      "type": "object",
      "additionalProperties": false,
      "required": ["id", "kind", "uri", "mediaType", "checksumSha256"],
      "properties": {
        "id": { "$ref": "#/$defs/id" },
        "kind": { "enum": ["audio", "soundfont", "impulse-response"] },
        "uri": { "type": "string", "minLength": 1 },
        "mediaType": { "type": "string", "minLength": 1 },
        "checksumSha256": { "type": "string", "pattern": "^[0-9a-f]{64}$" },
        "durationSeconds": { "type": "number", "exclusiveMinimum": 0 },
        "licenseId": { "$ref": "#/$defs/id" }
      }
    },
    "marker": {
      "type": "object",
      "additionalProperties": false,
      "required": ["id", "name", "position", "kind"],
      "properties": {
        "id": { "$ref": "#/$defs/id" },
        "name": { "type": "string", "minLength": 1 },
        "position": { "$ref": "#/$defs/position" },
        "kind": { "enum": ["section", "cue", "loop-start", "loop-end"] }
      }
    },
    "mixerChannel": {
      "type": "object",
      "additionalProperties": false,
      "required": ["volumeDb", "muted"],
      "properties": {
        "volumeDb": { "type": "number", "minimum": -96, "maximum": 12 },
        "muted": { "type": "boolean" }
      }
    },
    "mixer": {
      "type": "object",
      "additionalProperties": false,
      "required": ["music", "drums", "reverb", "master"],
      "properties": {
        "music": { "$ref": "#/$defs/mixerChannel" },
        "drums": { "$ref": "#/$defs/mixerChannel" },
        "reverb": { "$ref": "#/$defs/mixerChannel" },
        "master": { "$ref": "#/$defs/mixerChannel" }
      }
    },
    "generationMetadata": {
      "type": "object",
      "additionalProperties": false,
      "required": ["generatorId", "generatorVersion", "seed", "createdAt"],
      "properties": {
        "generatorId": { "$ref": "#/$defs/id" },
        "generatorVersion": { "type": "string", "minLength": 1 },
        "seed": { "type": "integer" },
        "createdAt": { "type": "string", "format": "date-time" },
        "prompt": { "type": "string" },
        "arrangementFingerprint": { "type": "string", "pattern": "^fnv1a64:[0-9a-f]{16}$" },
        "provenance": { "$ref": "#/$defs/generationProvenance" },
        "generatedNotes": {
          "type": "object",
          "additionalProperties": {
            "type": "object",
            "additionalProperties": { "type": "string", "pattern": "^[0-9a-f]{8}$" }
          }
        }
      }
    }
  }
}
